{
  "$schema": "https://json-schema.org/draft/2020-12/schema",
  "$id": "urn:atrium-capture:contract:guide-suggestion:1.0",
  "title": "AtriumCaptureGuideSuggestion",
  "description": "Assistant-written title, summary, and per-step text for a reviewed capture session. Text only; never images, selectors, or typed values.",
  "type": "object",
  "additionalProperties": false,
  "required": ["schemaVersion", "sessionId", "title", "summary", "steps"],
  "properties": {
    "schemaVersion": { "type": "integer", "const": 1 },
    "sessionId": { "type": "string", "format": "uuid" },
    "title": { "type": "string", "minLength": 1, "maxLength": 200 },
    "summary": { "type": "string", "minLength": 1, "maxLength": 600 },
    "steps": {
      "type": "array",
      "minItems": 1,
      "maxItems": 1000,
      "items": { "$ref": "#/$defs/guideSuggestionStep" }
    }
  },
  "$defs": {
    "guideSuggestionStep": {
      "title": "GuideSuggestionStep",
      "type": "object",
      "additionalProperties": false,
      "required": ["stepId", "title", "instruction"],
      "properties": {
        "stepId": { "type": "string", "format": "uuid" },
        "title": { "type": "string", "minLength": 1, "maxLength": 120 },
        "instruction": { "type": "string", "minLength": 1, "maxLength": 2000 }
      }
    }
  }
}
